	url	date	headline	body	source
20	https://www.scmp.com/news/china/diplomacy/article/3026210/us-defence-secretary-mark-espser-urges-beijing-show-restraint	2019-09-08	US Defence Secretary Mark Espser urges Beijing to show restraint in Hong Kong	"US Defence Secretary Mark Esper said Beijing should not intervene forcibly in Hong Kong and warned European countries against becoming too dependent on Chinese investment. “We would obviously urge restraint and not to act, and to sit down and talk with the protesters and resolve the differences,” Esper said at a press conference in Paris with his French counterpart Florence Parly. Esper “As countries increase their dependence on Chinese investment and trade they become more susceptible to coercion and retribution when they act outside Beijing’s wishes,” he said. “It is essential that all countries make well-informed decisions about their relationship with the Chinese.” Esper and Parly downplayed their recent differences over France’s refusal to join a naval force put together by the US to protect shipping in the Gulf following a series of attacks on oil tankers. Britain joined the US force while other European countries such as Germany said they would work with the French on a mission that was more geared toward surveillance. naval force US defence chief lectures European allies on danger of close ties with China
6 Sep 2019 US defence chief lectures European allies on danger of close ties with China
6 Sep 2019 Parly said the separate European initiative was “totally coordinated and in full transparency with our American friends. The idea is to rally the highest number of countries. There is no competition”."	SCMP
21	https://www.scmp.com/news/hong-kong/law-and-crime/article/3026180/hong-kong-protests-group-police-kin-comes-forward-end	2019-09-08	Hong Kong protests: group of police relatives comes forward to end animosity between force members and demonstrators	"A group claiming to comprise family members of police officers has stepped forward saying it hopes to see an end to worsening animosity between anti-government protesters and members of the force, as Hong Kong entered a 14th weekend of unrest. Among other things, it held a rally on August 25 and said it agreed with the protesters’ demand for an independent inquiry to investigate alleged police brutality – something the force opposes and the government has dismissed. Calling itself the Police Relatives Connection, the group has found itself under attack from protesters and been regarded with suspicion by police as well, with both groups saying its activities might be a ploy.   A woman, who identified herself as Joey Li and claimed to be the wife of a police officer, insists that the group is genuine and is planning more activities after attracting 400 people to its first rally. What are the weapons Hong Kong police use on protesters?
12 Aug 2019 What are the weapons Hong Kong police use on protesters?
12 Aug 2019 She said: “We want to build a bridge between the two sides to cool down the heat. We have no capability to ask both sides not to hate each other, but we want to take a first step, like starting a fire.”"	SCMP
22	https://www.scmp.com/news/china/diplomacy/article/3026188/businesswomen-defend-hong-kong-governments-handling-protests	2019-09-08	Businesswomen to defend Hong Kong government’s handling of protests at UN	Two Hong Kong businesswomen are expected to defend the government’s handling of protests in the city when the UN’s top human rights body meets in Geneva this week. Macau casino heiress Pansy Ho Chiu-king and Annie Wu Suk-ching, daughter of catering group Maxim’s founder James Tak Wu, will speak at the United Nations Human Rights Council on Tuesday. It comes as Beijing is ramping up efforts to sway international opinion on the months of anti-government protests in Hong Kong. The pair will give a speech on behalf of the Hong Kong Federation of Women, a pro-government organisation, presenting its views on the political crisis that has gripped the city.	SCMP
23	https://www.scmp.com/news/hong-kong/politics/article/3026189/mediators-hong-kong-anti-government-protests-face-arrest-if	2019-09-08	Mediators at Hong Kong anti-government protests face arrest if they obstruct police, force memo confirms	"Legislators and social workers who try to mediate at anti-government protests face arrest if they do not make way for advancing police cordons, guidelines handed down by the force’s top brass have made clear, as unrest in Hong Kong shows no sign of dying down. The advice would also apply when dealing with reporters, according to a memo issued by assistant commissioner Albert Yuen Yuk-kin on August 20. But social workers and lawmakers earlier arrested for obstructing officers vowed to stand their ground at protests, while the head of a major local journalists’ association said the force should remind frontline officers to be calm. On Friday, five social work groups wrote to Commissioner of Police Stephen Lo Wai-chung urging the force to recognise their supporting role on the front lines. At least 14 social workers have been arrested at protests, some charged with rioting, they said. Hong Kong prosecutor taken off police cases over protest comments
7 Sep 2019 Hong Kong prosecutor taken off police cases over protest comments
7 Sep 2019 According to Yuen’s memo, seen by the Post, the force noted that when officers push cordons forward they are often deliberately obstructed by members of the crowd, including lawmakers, reporters and social workers. Post"	SCMP
24	https://www.scmp.com/news/hong-kong/politics/article/3026162/hong-kong-justices-peace-denied-entry-police-detention	2019-09-08	Hong Kong justices of the peace denied entry to police detention centre where anti-government protesters were allegedly mistreated	Six Hong Kong justices of the peace (JPs) were denied entry to a police detention centre near the border with mainland China, following allegations that arrested protesters were mistreated there, the Post has learnt. Post A source said the group, including a former high-ranking official, recently wrote to the JPs’ secretariat under Chief Secretary Matthew Cheung Kin-chung’s office, asking to visit the San Uk Ling Holding Centre in Sheung Shui. But they were told that visiting the centre was not within the scope of what they could do, as it was not on the list of institutions they could visit. Aside from the JPs who could not get in, lawyers have complained of delays in seeing their clients detained there. A group of pro-democracy lawmakers now say they want to visit the place. Questions were raised about the centre in the New Territories, after 31 of 54 protesters arrested on August 11 and detained there were later hospitalised, six with fractured bones.	SCMP
25	https://www.scmp.com/news/hong-kong/politics/article/3026187/quieter-day-protest-hong-kong-amid-tight-security-tensions	2019-09-08	Tensions flare late at night after quieter day of protest in Hong Kong	Fewer protesters turned out on the streets on Saturday, days after Hong Kong Chief Executive Carrie Lam Cheng Yuet-ngor announced the formal withdrawal of the extradition bill that sparked the worst unrest in the city in decades. extradition bill No tear gas was used and no petrol bombs were thrown at the start of the 14th weekend of anti-government protests, as the large-scale violence seen in previous weekends was avoided. But a handful of demonstrators were arrested. Strong pre-emptive police and government action snuffed out the protesters’ attempt to again besiege the Hong Kong International Airport. The MTR Corporation, the city’s main railway operator, closed Kowloon, Tsing Yi and AsiaWorld-Expo stations on the Airport Express line, leaving only Hong Kong station and the airport station open, with a heavy police presence at both. Police also set up checkpoints on approach roads to the airport, even taking the unprecedented step of searching passengers’ bags on buses and trains.    The increased security prevented the chaos seen last weekend, when protesters paralysed airport traffic and left hundreds of travellers stranded. That followed a separate demonstration in August, when protesters occupied the arrivals hall, causing the cancellation of more than 900 flights at one of the world’s busiest airports.	SCMP
26	https://www.scmp.com/news/hong-kong/politics/article/3026184/no-protesters-killed-during-police-actions-hong-kong	2019-09-08	No protesters killed during police actions, Hong Kong government says, as it slams ‘malicious’ rumours swirling about deaths during mayhem at MTR station	"No protesters have been killed in police action over the past three months of demonstrations, the Hong Kong government has stressed, as rumours that at least three people were beaten to death sparked hysteria. The government issued the strong denial on Saturday, calling the rumours malicious. “It is deeply regrettable that such an irresponsible rumour keeps spreading with the ill-intent to mislead members of the public, and to sow division and discontent in society at a time when the government is sincerely trying to establish a dialogue platform,” it said in a statement. However, some people remained unconvinced and gathered outside the MTR station at the centre of the rumour, calling for “truth and justice”.    Online speculation revolved around a revision to the number of people injured during chaotic scenes on August 31 as radical anti-government protesters clashed with riot police at Prince Edward MTR station. The MTR Corporation was forced to close the station, which was badly vandalised, for two days. MTR Corporation Prince Edward MTR station shut down as handful of protesters gather
7 Sep 2019 Prince Edward MTR station shut down as handful of protesters gather
7 Sep 2019 Protesters and their supporters accused police of behaving like “gangsters” and indiscriminately beating commuters in the station, a claim the force flatly rejected. force flatly rejected"	SCMP
27	https://www.scmp.com/news/hong-kong/law-and-crime/article/3026179/hong-kong-journalists-association-condemns-attack	2019-09-07	Hong Kong Journalists Association condemns attack on reporter covering anti-government protests	"The Hong Kong Journalists Association has condemned an attack on a reporter at midnight on Friday and expressed indignation at police’s inaction against the culprit. In a statement issued on Saturday afternoon, the association said a reporter with Stand News was hit to the ground by a middle-aged man when he was filming a riot police operation to disperse anti-government protesters at Kowloon Wholesale Fruit Market in Yau Ma Tei. Stand News “The association strongly condemns the violent act. Using violence on reporters seriously infringes freedom of press,” the statement said. Attacks on journalists cannot be tolerated
1 Jul 2019 Attacks on journalists cannot be tolerated
1 Jul 2019 “We feel indignant at the failure of police in stopping or detaining the attacker,” the association said, urging police to investigate the incident."	SCMP
28	https://www.scmp.com/news/hong-kong/politics/article/3026171/hong-kong-police-officers-served-more-100-boxes-raw-chicken	2019-09-08	Hong Kong police officers served more than 100 boxes of raw chicken for dinner ordered from city supplier	"More than 100 meal boxes sent to Hong Kong police officers on Friday night contained raw chicken, the Post has learned. Post Officers of the Police Tactical Unit at Sheung Shui station realised that their dinner – chicken pasta – contained uncooked meat before anyone consumed it, according to an internal memo from the force seen by the Post. Post The force immediately ordered food from other canteens and distributed cup noodles to officers who got the raw meat, it said. But some officers had to rush to Sham Shui Po and Prince Edward to disperse anti-government protesters before the replacement food arrived, according to messages posted on social media. Rumours began spreading online soon after the incident that local food chain Maxim’s had provided the meal boxes. But police sent out another internal memo just after midnight on Saturday, saying the food was not procured from Maxim’s but stopping short of naming the supplier. Police dismiss accusations of excessive force at Prince Edward MTR station
5 Sep 2019 Police dismiss accusations of excessive force at Prince Edward MTR station
5 Sep 2019 Police have confirmed the incident, but the Food and Environmental Hygiene Department said it had yet to receive any complaint. However, it appeared the incident was not linked to anti-police sentiments among some sections of the public over officers’ handling of extradition bill protests."	SCMP
29	https://www.scmp.com/news/hong-kong/politics/article/3026154/pre-emptive-police-measures-allow-hong-kong-airport-run	2019-09-07	Prince Edward MTR station shut down as handful of protesters gather, while Hong Kong airport operator warns crowd at bus station to leave, citing court order	A Hong Kong railway station which has become the latest flashpoint in a city bracing for its 14th straight weekend of protests has been closed down, while at the airport, crowds at the bus terminal are asked to leave under an injunction. Shortly before 4.30pm on Saturday, 10 protesters had gathered at Prince Edward MTR station, with the rail giant announcing the site’s closure after a risk assessment. The MTR Corporation also said other stations might be closed later in the day.    Douglas Tsang Tsz-ming, 30, one of the protesters at Prince Edward, said he was there over the August 31 incident, in which police chased demonstrators into the station and went after them on trains, resulting in injuries. Protesters have accused police of indiscriminately beating commuters, while the force said its officers were targeting those who had changed out of their trademark black outfits to blend in with passengers. Tsang said: “That’s why we call for the MTR Corp to release the CCTV tapes [at Prince Edward station] to the public to disclose the truth.”	SCMP
30	https://www.scmp.com/news/hong-kong/politics/article/3026149/hong-kong-prosecutor-taken-police-cases-over-facebook	2019-09-07	Hong Kong prosecutor taken off police cases over Facebook comments related to anti-government protests	A Hong Kong government lawyer has been taken off police-related court cases after making online comments about anti-government protests which have rocked the city for months. The arrangement came to light as tensions mounted between prosecutors and the embattled police force, after the head of a court workers’ body accused police of lying over the arrests of pro-democracy activists. accused police of lying In a circular to all staff on Friday, the justice department announced a prosecutor had been reassigned after it received a media inquiry. “The prosecutor has not been involved in any public order event cases,” the Department of Justice’s administration division wrote. “To avoid a public perception that the prosecutor is unable to fairly and impartially exercise his duty due to his public remarks, he will not be handling cases involving police.”	SCMP
31	https://www.scmp.com/news/hong-kong/law-and-crime/article/3026143/police-groups-hong-kong-write-yuen-long-school-over	2019-09-07	Police groups in Hong Kong write to Yuen Long school over teacher’s ‘spread of hatred’ against force amid protest tensions	Four police groups have written to a school principal to complain about a member of staff who they claim spread hate towards the force and promoted bullying of officers’ children. The letter, dated Friday, was copied to city leader Carrie Lam Cheng Yuet-ngor and education minister Kevin Yeung Yun-hung. It named a teacher from Yuen Long Public Middle School Alumni Association Primary School, saying he had posted hate speech and personal information of police officers and their children on social media. Tensions have risen between police and some Hong Kong residents, amid anger over perceived excessive use of force during anti-government demonstrations which have rocked the city for months. The force has complained of abuse by members of the public, and the use of doxxing, in which the personal details of officers and their families are shared online. The four staff associations – representing superintendents, inspectors, overseas inspectors and rank-and-file officers – accused the teacher of promoting bullying.	SCMP
32	https://www.scmp.com/news/hong-kong/society/article/3026070/hongkongers-not-expats-foreigners-who-say-they-have-joined	2019-09-07	‘Hongkongers, not expats’: the foreigners who say they have joined the protests out of a sense of responsibility to their adopted city		SCMP
33	https://www.scmp.com/news/hong-kong/politics/article/3026134/hong-kong-protests-city-braces-another-weekend-chaos-and	2019-09-07	Hong Kong protests: city braces for another weekend of chaos and rail authorities change plans as demonstrators target airport again		SCMP
34	https://www.scmp.com/news/hong-kong/politics/article/3026114/watchdog-panel-may-need-more-clout-summon-evidence-and	2019-09-07	Watchdog panel may need more clout to ensure thorough probe of how Hong Kong police handled protests, head of foreign expert team says		SCMP
35	https://www.scmp.com/news/hong-kong/society/article/3026118/hong-kong-protests-police-start-probe-author-online-article	2019-09-07	Hong Kong protests: police start probe as author of online article claims responsibility for stabbing off-duty officer at Kwai Fong rail station on August 30		SCMP
36	https://www.scmp.com/news/asia/southeast-asia/article/3026113/hong-kong-protests-show-limit-one-country-two-systems	2019-09-07	Hong Kong protests show limit of ‘one country, two systems’, Malaysia’s Mahathir says		SCMP
37	https://www.scmp.com/news/hong-kong/hong-kong-economy/article/3026109/beleaguered-hong-kong-hit-double-whammy-fitch	2019-09-07	Beleaguered Hong Kong hit by double whammy as Fitch Ratings downgrades city and stock exchange hit by cyberattacks		SCMP
38	https://www.scmp.com/news/hong-kong/education/article/3026106/hong-kong-protests-pupils-shy-away-class-boycotts	2019-09-09	Hong Kong protests: pupils shy away from class boycotts, but thousands champion anti-government demands in schools, forming human chains and wearing masks		SCMP
39	https://www.scmp.com/news/hong-kong/politics/article/3026066/hong-kong-protests-reflect-anti-mainland-china-sentiment	2019-09-06	As Hong Kong protests reflect anti-mainland China sentiment, Carrie Lam boosts cross-border ties		SCMP
40	https://www.scmp.com/news/hong-kong/transport/article/3026054/prince-edward-mtr-station-closed-crowds-gather-inside	2019-09-07	Hong Kong protests: tear gas fired on Nathan Road as demonstrations force closure of multiple MTR stations, including Prince Edward, Mong Kok and Yau Ma Tei	"Multiple railway stations were closed as Hong Kong protests wreaked havoc on the MTR network, on another night of violence and tear gas on the city’s streets. Hong Kong’s rail operator shut Prince Edward station during Friday’s rush hour after crowds gathered there calling for the release of CCTV footage of police taking action against anti-government protesters at the interchange on August 31. police taking action against anti-government protesters at the interchange on August 31 Tear gas was later fired on Nathan Road, one of Hong Kong’s main thoroughfares, before crowds and vandalism forced the closure of most of the Tsuen Wan line, with all services suspended between Central and Mei Foo. There were ugly scenes further south on Canton Road, where witnesses saw a man lashing out with a meat cleaver, leading protesters to besiege the residential building where he was believed to be hiding. Hong Kong’s double trouble: ratings downgrade and stock exchange cyberattacks
7 Sep 2019 Hong Kong’s double trouble: ratings downgrade and stock exchange cyberattacks
7 Sep 2019 The MTR Corporation said shortly before the midnight that services were suspended to ensure staff and passenger safety “as equipment at Prince Edward, Mong Kok, and Yau Ma Tei stations is damaged and crowds gather near to stations”."	SCMP
41	https://www.scmp.com/news/china/politics/article/3026016/chinese-premier-li-keqiang-supports-hong-kong-government-end	2019-09-07	Hong Kong is a matter for China, Premier Li Keqiang tells Angela Merkel	Chinese Premier Li Keqiang said on Friday that Beijing would safeguard the one country, two systems and support Hong Kong government efforts to end the crisis which has engulfed the city for months, as German Chancellor Angela Merkel called for “utmost” effort to avoid violence. Merkel, in her visit to Beijing, also called for resolving the crisis through peaceful dialogue as concerns remained whether Beijing would deploy troops to end the unrest in the city and violence by the protesters.    Merkel had last month called for a peaceful solution to the unrest in Hong Kong, but it was the first time she directly raised the issue with a top Chinese leader. Li is the highest ranking Chinese official to comment on Hong Kong since protests erupted in the former British colony over an extradition bill – which has now been formally withdrawn.	SCMP
42	https://www.scmp.com/news/hong-kong/politics/article/3025997/hong-kong-school-boycott-continues-hundreds-turn-out	2019-09-06	Hong Kong school boycott continues as hundreds turn out in support and call on Carrie Lam to meet all demands made by anti-government protesters	"Nearly a thousand alumni and students across Hong Kong added their voices to a citywide protest on Friday, as demonstrators called on the government to meet all their demands and do more than just withdrawing the extradition bill. They formed human chains outside schools in Kowloon Tong, Tai Po and on Hong Kong Island, and asked other students to join them to put pressure on Chief Executive Carrie Lam Cheng Yuet-ngor’s administration. Protesters want an independent investigation into the use of force by police, an amnesty for arrested protesters, a halt to categorising the protests as riots, and the implementation of universal suffrage. Their show of defiance continued despite Lam’s announcement on Wednesday that she would formally withdraw the extradition bill that has sparked months of protests in the city. Teenager sent to children’s home after protest arrest is released
5 Sep 2019 Teenager sent to children’s home after protest arrest is released
5 Sep 2019 With Lam only acceding to one of the demonstrators’ five demands, protesters and politicians from both sides of the divide have said the move was too little, too late."	SCMP
43	https://www.scmp.com/news/hong-kong/politics/article/3025993/woman-says-she-needed-stitches-her-head-after-hong-kong	2019-09-07	Woman says she needed stitches on her head after Hong Kong police beat her at Siu Hong MTR station and she now supports probe into their use of force	Tuen Mun resident Rachel Smyth has never joined any of the extradition-bill protests which have gripped Hong Kong since June. But on Sunday night the 40-year-old English teacher ended up with a bleeding head and bruises on her body inflicted by the batons of riot police at an MTR station. That evening, the riot squad appeared in a number of neighbourhoods – including Siu Hong, where Smyth lives – after anti-government protesters defied a court injunction and paralysed transport routes to Hong Kong International Airport. Some officers went to Central Pier to intercept young passengers, while others conducted spot checks in Tin Shui Wai, close to Siu Hong. Smyth, a Hong Kong-born Australian citizen, said she was returning home from Central by train after having coffee, wearing a black T-shirt, as she often does, and saw at least 20 riot officers at Siu Hong station at about 10.30pm. Facilities in the station had been damaged but there were no protesters around. Out of curiosity and concern, she said, she stayed on a staircase that led to Siu Hong Court to see what was going on. About 50 to 60 residents were also there, chanting at officers, urging them to leave to avoid further unrest in their neighbourhood.	SCMP
44	https://www.scmp.com/news/hong-kong/politics/article/3025932/hong-kongs-pro-government-lawmakers-brace-impact-district	2019-09-06	Hong Kong’s pro-government lawmakers brace for impact in district council elections following Carrie Lam’s withdrawal of extradition bill	A day after Hong Kong leader Carrie Lam Cheng Yuet-ngor’s decision to formally withdraw the extradition bill, a pro-government lawmaker has warned of voters punishing the camp in the coming elections, but other members insist it is too early to panic. decision to formally withdraw the extradition bill, Elizabeth Quat, from the leading pro-establishment party the Democratic Alliance for Betterment and Progress of Hong Kong (DAB), said supporters who had all along backed the bill were particularly disappointed. “They think the government has yielded to violence. We fear these people might be so disappointed they will not come out to vote to show their discontent,” Quat said. Lam announced on Wednesday she would formally withdraw the unpopular extradition bill that had sparked three months of turmoil in the city. Beijing loyalists had thrown their weight behind the bill, which would have allowed the transfer of criminal suspects to mainland China and other jurisdictions with which Hong Kong lacked an arrangement.	SCMP
